{
  "id": "DREL-AGENT-001",
  "owner_doctrine": "DOC-AGENT-008",
  "relation": "supports",
  "target": "DOC-SWARM-012",
  "conditions": ["agent_coordination_cost_is_material"],
  "status": "covered",
  "evidence": ["EV-0088", "EV-0452"],
  "fallback": "Run one bounded agent with an external oracle until a decomposable graph and measured control justify coordination.",
  "wargame": "GD-AGENT-001",
  "owner": "agentic-development",
  "review": "on-change-of:https://arxiv.org/abs/2512.08296"
}
