{
  "id": "DREL-UIUX-001",
  "owner_doctrine": "DOC-UIUX-009",
  "relation": "depends_on",
  "target": "DOC-DISC-016",
  "conditions": ["serves_novice_and_expert_users"],
  "status": "covered",
  "evidence": ["EV-0239", "EV-0404"],
  "fallback": "Choose the surface philosophy from representative novice and expert task evidence, not an estate-wide density preference.",
  "wargame": "GD-UIUX-001",
  "owner": "ui-ux",
  "review": "2027-02"
}
