{
  "id": "DREL-HOUSE-001",
  "owner_doctrine": "DOC-HOUSE-004",
  "relation": "tensions_with",
  "target": "DOC-UIUX-014",
  "conditions": ["house_style_costs_access_or_performance"],
  "status": "covered",
  "evidence": ["EV-0397", "EV-0027"],
  "fallback": "Remove or reduce the house motion until reduced-motion behaviour and the target-device budget pass.",
  "wargame": "WG-UIUX-005",
  "owner": "pattertech-house",
  "review": "on-change-of:WCAG-2.2"
}
